family_id,domain_id,Domain,family_name,family_purpose,key_behavioral_scope,relational_bridge_tag
FAM_EMO_001,DOM_001,Emotional Intelligence,fear_signals,Measure fear-driven emotional reactions and insecurity patterns,"fear_of_failure, rejection_fear, uncertainty_fear",ADJUSTMENT_COPING
FAM_EMO_002,DOM_001,Emotional Intelligence,anxiety_signals,Detect persistent anxiety and emotional tension patterns,"anxiety, nervousness, anticipatory stress",ADJUSTMENT_COPING
FAM_EMO_003,DOM_001,Emotional Intelligence,overload_signals,Identify emotional overwhelm and cognitive-emotional flooding,"overwhelm, emotional saturation, stress overload",ADJUSTMENT_COPING
FAM_EMO_004,DOM_001,Emotional Intelligence,confidence_signals,Assess emotional confidence and self-assurance stability,"self-confidence, emotional security",ADJUSTMENT_COPING
FAM_EMO_005,DOM_001,Emotional Intelligence,shame_signals,Detect shame sensitivity and emotional suppression tendencies,"embarrassment, guilt, humiliation sensitivity",ADJUSTMENT_COPING
FAM_EMO_006,DOM_001,Emotional Intelligence,hopelessness_signals,Measure emotional hopelessness and future pessimism,"helplessness, despair, emotional shutdown",ADJUSTMENT_COPING
FAM_EMO_007,DOM_001,Emotional Intelligence,emotional_regulation_signals,Evaluate emotional self-regulation and recovery capability,"calming ability, emotional control",ADJUSTMENT_COPING
FAM_EMO_008,DOM_001,Emotional Intelligence,emotional_reactivity_signals,Measure intensity of emotional reactions under stress,"impulsive reactions, emotional volatility",ADJUSTMENT_COPING
FAM_EMO_009,DOM_001,Emotional Intelligence,emotional_suppression_signals,Detect hidden emotional masking and suppression behavior,"emotional hiding, emotional bottling",ADJUSTMENT_COPING
FAM_EMO_010,DOM_001,Emotional Intelligence,emotional_resilience_signals,Assess emotional recovery after setbacks and failures,"bounce-back ability, emotional endurance",ADJUSTMENT_COPING
FAM_EMO_011,DOM_001,Emotional Intelligence,vulnerability_signals,Measure emotional openness and vulnerability tolerance,"emotional sharing, openness to support",ADJUSTMENT_COPING
FAM_EMO_012,DOM_001,Emotional Intelligence,self_soothing_signals,Assess ability to emotionally stabilize oneself independently,"self-comforting, emotional grounding",ADJUSTMENT_COPING
FAM_EMO_013,DOM_001,Emotional Intelligence,frustration_signals,Detect frustration tolerance and irritation patterns,"impatience, emotional irritation",ADJUSTMENT_COPING
FAM_EMO_014,DOM_001,Emotional Intelligence,emotional_fatigue_signals,Measure emotional exhaustion and depletion trends,"emotional tiredness, mental fatigue",ADJUSTMENT_COPING
FAM_EMO_015,DOM_001,Emotional Intelligence,panic_response_signals,Detect panic-oriented reactions during uncertainty or pressure,"panic, emotional flooding, loss of control",ADJUSTMENT_COPING
FAM_EMO_016,DOM_001,Emotional Intelligence,emotional_stability_signals,Measure consistency and steadiness of emotional state,"emotional steadiness, stability",ADJUSTMENT_COPING
FAM_EMO_017,DOM_001,Emotional Intelligence,emotional_dependency_signals,Assess emotional reliance on external reassurance or support,"reassurance dependence, emotional reliance",ADJUSTMENT_COPING
FAM_EMO_018,DOM_001,Emotional Intelligence,guilt_sensitivity_signals,Detect excessive guilt and self-blame tendencies,"self-blame, guilt burden",ADJUSTMENT_COPING
FAM_EMO_019,DOM_001,Emotional Intelligence,emotional_awareness_signals,Measure awareness and recognition of internal emotional states,"emotional insight, self-awareness",ADJUSTMENT_COPING
FAM_EMO_020,DOM_001,Emotional Intelligence,emotional_recovery_signals,Assess speed and quality of emotional recovery after stress,"recovery pace, emotional reset ability",ADJUSTMENT_COPING
COG_FAM_001,DOM_002,Cognitive Intelligence,clarity_signals,Measure clarity of thinking and mental organization,"clarity, structured thinking, comprehension",GENERAL_CONCERN
COG_FAM_002,DOM_002,Cognitive Intelligence,confusion_signals,Detect confusion and cognitive instability,"confusion, ambiguity, mental disorientation",GENERAL_CONCERN
COG_FAM_003,DOM_002,Cognitive Intelligence,decision_signals,Assess decision quality and decisiveness,"indecision, commitment instability",GENERAL_CONCERN
COG_FAM_004,DOM_002,Cognitive Intelligence,overthinking_signals,Measure excessive cognitive looping,"rumination, over-analysis, repetitive thinking",GENERAL_CONCERN
COG_FAM_005,DOM_002,Cognitive Intelligence,reasoning_signals,Evaluate logical reasoning quality,"analytical thinking, reasoning consistency",GENERAL_CONCERN
COG_FAM_006,DOM_002,Cognitive Intelligence,future_orientation_signals,Assess future thinking and long-term mental projection,"future planning, anticipation, vision clarity",GENERAL_CONCERN
COG_FAM_007,DOM_002,Cognitive Intelligence,judgment_signals,Measure judgment stability under uncertainty,"judgment quality, cognitive balance",GENERAL_CONCERN
COG_FAM_008,DOM_002,Cognitive Intelligence,complexity_handling_signals,Evaluate ability to handle complexity,"ambiguity tolerance, multi-variable thinking",GENERAL_CONCERN
COG_FAM_009,DOM_002,Cognitive Intelligence,prioritization_signals,Measure prioritization effectiveness,"task prioritization, importance ranking",GENERAL_CONCERN
COG_FAM_010,DOM_002,Cognitive Intelligence,mental_flexibility_signals,Assess adaptability in thinking patterns,"cognitive flexibility, perspective shifting",GENERAL_CONCERN
COG_FAM_011,DOM_002,Cognitive Intelligence,problem_solving_signals,Measure problem-solving capability,"solution generation, issue resolution",GENERAL_CONCERN
COG_FAM_012,DOM_002,Cognitive Intelligence,strategic_thinking_signals,Assess strategic planning and thinking depth,"long-term strategy, planning intelligence",GENERAL_CONCERN
COG_FAM_013,DOM_002,Cognitive Intelligence,cognitive_stability_signals,Detect consistency of thought processes,"stability, mental coherence",GENERAL_CONCERN
COG_FAM_014,DOM_002,Cognitive Intelligence,abstraction_signals,Measure abstract and conceptual thinking ability,"conceptualization, abstract reasoning",GENERAL_CONCERN
COG_FAM_015,DOM_002,Cognitive Intelligence,cognitive_speed_signals,Assess mental processing speed,"response speed, mental agility",GENERAL_CONCERN
COG_FAM_016,DOM_002,Cognitive Intelligence,attention_control_signals,Measure focus and attention management,"concentration, distraction control",GENERAL_CONCERN
COG_FAM_017,DOM_002,Cognitive Intelligence,learning_processing_signals,Evaluate information processing effectiveness,"comprehension, retention, processing stability",GENERAL_CONCERN
COG_FAM_018,DOM_002,Cognitive Intelligence,uncertainty_navigation_signals,Assess handling of uncertainty and ambiguity,"uncertainty tolerance, adaptive cognition",GENERAL_CONCERN
COG_FAM_019,DOM_002,Cognitive Intelligence,self_reflection_signals,Measure reflective thinking and introspection,"self-analysis, reflective cognition",GENERAL_CONCERN
COG_FAM_020,DOM_002,Cognitive Intelligence,cognitive_resilience_signals,Assess recovery and stability after cognitive overload,"recovery thinking, mental endurance",GENERAL_CONCERN
FAM_BEH_001,DOM_003,Behavioral Intelligence,avoidance_signals,Detect behavioral avoidance patterns under stress or uncertainty,"opportunity avoidance, challenge escape, participation decline",ADJUSTMENT_COPING
FAM_BEH_002,DOM_003,Behavioral Intelligence,execution_signals,Measure consistency in converting intent into action,"task execution, action reliability, implementation consistency",GENERAL_CONCERN
FAM_BEH_003,DOM_003,Behavioral Intelligence,withdrawal_signals,Detect emotional and social withdrawal behavior,"disengagement, isolation, silent retreat",ADJUSTMENT_COPING
FAM_BEH_004,DOM_003,Behavioral Intelligence,participation_signals,Assess willingness to actively engage in activities and discussions,"participation, involvement, contribution behavior",GENERAL_CONCERN
FAM_BEH_005,DOM_003,Behavioral Intelligence,procrastination_signals,Measure delay-oriented behavioral patterns,"postponement, avoidance delay, execution lag",GENERAL_CONCERN
FAM_BEH_006,DOM_003,Behavioral Intelligence,consistency_signals,Evaluate stability of routines and behavioral repetition,"habit consistency, behavioral predictability",DISCIPLINE_HABITS
FAM_BEH_007,DOM_003,Behavioral Intelligence,accountability_signals,Assess ownership and responsibility-taking behavior,"responsibility acceptance, ownership mindset",GENERAL_CONCERN
FAM_BEH_008,DOM_003,Behavioral Intelligence,initiative_behavior_signals,Measure proactive action-taking tendencies,"self-starting behavior, initiative, activation",GENERAL_CONCERN
FAM_BEH_009,DOM_003,Behavioral Intelligence,persistence_behavior_signals,Detect sustained effort despite obstacles,"perseverance, effort continuity",GENERAL_CONCERN
FAM_BEH_010,DOM_003,Behavioral Intelligence,engagement_signals,Measure emotional and behavioral engagement levels,"attentiveness, active involvement",ADJUSTMENT_COPING
FAM_BEH_011,DOM_003,Behavioral Intelligence,discipline_signals,Assess self-discipline and behavioral control,"routine adherence, behavioral discipline",DISCIPLINE_HABITS
FAM_BEH_012,DOM_003,Behavioral Intelligence,followthrough_signals,Measure ability to complete initiated actions,"completion consistency, commitment execution",GENERAL_CONCERN
FAM_BEH_013,DOM_003,Behavioral Intelligence,responsiveness_signals,"Detect responsiveness to expectations, tasks, and feedback","reaction speed, adaptive response behavior",GENERAL_CONCERN
FAM_BEH_014,DOM_003,Behavioral Intelligence,risk_avoidance_signals,Measure avoidance of uncertain or high-pressure situations,"fear-driven avoidance, hesitation behavior",ADJUSTMENT_COPING
FAM_BEH_015,DOM_003,Behavioral Intelligence,adaptability_behavior_signals,Assess behavioral flexibility during changing situations,"situational adjustment, behavioral adaptation",ADJUSTMENT_COPING
FAM_BEH_016,DOM_003,Behavioral Intelligence,dependency_behavior_signals,Detect over-reliance on others for action or decisions,"external dependency, approval reliance",GENERAL_CONCERN
FAM_BEH_017,DOM_003,Behavioral Intelligence,impulsive_behavior_signals,Measure impulsive or poorly controlled actions,"impulsivity, reactive behavior",GENERAL_CONCERN
FAM_BEH_018,DOM_003,Behavioral Intelligence,routine_stability_signals,Assess stability of productive behavioral routines,"structured habits, daily consistency",GENERAL_CONCERN
FAM_BEH_019,DOM_003,Behavioral Intelligence,behavioral_recovery_signals,Measure recovery speed after behavioral setbacks,"comeback behavior, resilience in action",GENERAL_CONCERN
FAM_BEH_020,DOM_003,Behavioral Intelligence,behavioral_resistance_signals,"Detect resistance toward change, guidance, or expectations","stubbornness, passive resistance, non-compliance",GENERAL_CONCERN
FAM_MOT_001,DOM_004,Motivational Intelligence,burnout_signals,Detect emotional and motivational exhaustion,"burnout, exhaustion, emotional fatigue",ADJUSTMENT_COPING
FAM_MOT_002,DOM_004,Motivational Intelligence,persistence_signals,Measure consistency of effort despite setbacks,"perseverance, sustained effort",GENERAL_CONCERN
FAM_MOT_003,DOM_004,Motivational Intelligence,aspiration_signals,Assess ambition and future achievement orientation,"ambition, growth goals",GENERAL_CONCERN
FAM_MOT_004,DOM_004,Motivational Intelligence,drive_signals,Measure intensity of internal motivation,"enthusiasm, energy, initiative",GENERAL_CONCERN
FAM_MOT_005,DOM_004,Motivational Intelligence,disengagement_signals,Detect motivational withdrawal and detachment,"apathy, disinterest, disengagement",GENERAL_CONCERN
FAM_MOT_006,DOM_004,Motivational Intelligence,achievement_orientation_signals,Measure desire for achievement and accomplishment,"success focus, achievement striving",GENERAL_CONCERN
FAM_MOT_007,DOM_004,Motivational Intelligence,growth_orientation_signals,Assess openness toward growth and self-improvement,"growth mindset, self-development",GENERAL_CONCERN
FAM_MOT_008,DOM_004,Motivational Intelligence,effort_stability_signals,Measure stability of effort over time,"consistency, discipline",DISCIPLINE_HABITS
FAM_MOT_009,DOM_004,Motivational Intelligence,energy_sustainability_signals,Assess ability to maintain motivational energy,"stamina, sustainable effort",GENERAL_CONCERN
FAM_MOT_010,DOM_004,Motivational Intelligence,goal_commitment_signals,Measure commitment toward long-term goals,"dedication, commitment stability",GENERAL_CONCERN
FAM_MOT_011,DOM_004,Motivational Intelligence,reward_dependency_signals,Detect dependence on external rewards for motivation,"validation dependency, reward seeking",GENERAL_CONCERN
FAM_MOT_012,DOM_004,Motivational Intelligence,initiative_activation_signals,Assess willingness to initiate action independently,"proactive engagement, initiative",GENERAL_CONCERN
FAM_MOT_013,DOM_004,Motivational Intelligence,motivational_resilience_signals,Measure recovery of motivation after failure,bounce-back motivation,GENERAL_CONCERN
FAM_MOT_014,DOM_004,Motivational Intelligence,ambition_stability_signals,Assess stability and sustainability of ambition,aspiration consistency,GENERAL_CONCERN
FAM_MOT_015,DOM_004,Motivational Intelligence,self_activation_signals,Measure self-driven action tendencies,self-starting behavior,GENERAL_CONCERN
FAM_MOT_016,DOM_004,Motivational Intelligence,learning_drive_signals,Assess motivation toward continuous learning,curiosity-driven learning,GENERAL_CONCERN
FAM_MOT_017,DOM_004,Motivational Intelligence,performance_drive_signals,Measure motivation to perform under pressure,competitive motivation,GENERAL_CONCERN
FAM_MOT_018,DOM_004,Motivational Intelligence,purpose_alignment_signals,Assess alignment between goals and personal meaning,meaningful engagement,GENERAL_CONCERN
FAM_MOT_019,DOM_004,Motivational Intelligence,motivational_volatility_signals,Detect fluctuations in motivation levels,"inconsistency, unstable drive",GENERAL_CONCERN
FAM_MOT_020,DOM_004,Motivational Intelligence,recovery_energy_signals,Measure restoration of energy after stress or burnout,"recovery readiness, energy restoration",ADJUSTMENT_COPING
FAM_SOC_001,DOM_005,Social Intelligence,peer_comparison_signals,Measure comparison-driven emotional and behavioral reactions,"peer comparison, inferiority feelings, competitive insecurity",ADJUSTMENT_COPING
FAM_SOC_002,DOM_005,Social Intelligence,approval_seeking_signals,Detect dependency on external validation and acceptance,"validation dependency, social approval needs",GENERAL_CONCERN
FAM_SOC_003,DOM_005,Social Intelligence,belonging_signals,Assess emotional sense of inclusion and belonging,"belonging insecurity, exclusion sensitivity",ADJUSTMENT_COPING
FAM_SOC_004,DOM_005,Social Intelligence,communication_comfort_signals,Measure comfort during interpersonal interactions,"social comfort, conversational ease",GENERAL_CONCERN
FAM_SOC_005,DOM_005,Social Intelligence,social_confidence_signals,Assess confidence in social and public environments,"social confidence, visibility comfort",GENERAL_CONCERN
FAM_SOC_006,DOM_005,Social Intelligence,interaction_quality_signals,Evaluate quality and consistency of interpersonal interactions,"interaction effectiveness, relationship stability",GENERAL_CONCERN
FAM_SOC_007,DOM_005,Social Intelligence,judgment_fear_signals,Detect fear of criticism and social evaluation,"fear of judgment, embarrassment avoidance",ADJUSTMENT_COPING
FAM_SOC_008,DOM_005,Social Intelligence,social_withdrawal_signals,Measure avoidance of social participation and engagement,"isolation, social disengagement",GENERAL_CONCERN
FAM_SOC_009,DOM_005,Social Intelligence,visibility_anxiety_signals,Assess discomfort with attention and visibility,"stage fear, visibility hesitation",ADJUSTMENT_COPING
FAM_SOC_010,DOM_005,Social Intelligence,networking_signals,Measure ability and willingness to build connections,"networking confidence, professional interaction",GENERAL_CONCERN
FAM_SOC_011,DOM_005,Social Intelligence,relationship_trust_signals,Assess trust-building and emotional openness in relationships,"trust development, emotional openness",ADJUSTMENT_COPING
FAM_SOC_012,DOM_005,Social Intelligence,empathy_signals,Measure emotional understanding and sensitivity toward others,"empathy, emotional responsiveness",ADJUSTMENT_COPING
FAM_SOC_013,DOM_005,Social Intelligence,conflict_response_signals,Detect reactions and coping patterns during interpersonal conflict,"conflict handling, emotional regulation in disagreements",ADJUSTMENT_COPING
FAM_SOC_014,DOM_005,Social Intelligence,collaboration_readiness_signals,Assess willingness to cooperate and work with others,"teamwork readiness, cooperative engagement",GENERAL_CONCERN
FAM_SOC_015,DOM_005,Social Intelligence,influence_sensitivity_signals,Measure susceptibility to peer and social influence,"peer pressure, external influence dependency",GENERAL_CONCERN
FAM_SOC_016,DOM_005,Social Intelligence,social_assertiveness_signals,Assess confidence in expressing opinions and boundaries,"assertiveness, boundary communication",GENERAL_CONCERN
FAM_SOC_017,DOM_005,Social Intelligence,emotional_expression_signals,Measure openness and comfort in expressing emotions socially,"emotional disclosure, expression comfort",ADJUSTMENT_COPING
FAM_SOC_018,DOM_005,Social Intelligence,group_participation_signals,Assess engagement quality in team and group settings,"group interaction, collaborative participation",GENERAL_CONCERN
FAM_SOC_019,DOM_005,Social Intelligence,interpersonal_resilience_signals,Measure recovery ability after rejection or social setbacks,"rejection recovery, social resilience",GENERAL_CONCERN
FAM_SOC_020,DOM_005,Social Intelligence,social_adaptation_signals,Assess adaptability across different social environments,"situational adjustment, social flexibility",ADJUSTMENT_COPING
FAM_EXEC_001,DOM_006,Executive Function Intelligence,planning_signals,Measure planning ability and future task organization,"planning, scheduling, preparation",GENERAL_CONCERN
FAM_EXEC_002,DOM_006,Executive Function Intelligence,prioritization_signals,Assess ability to prioritize tasks effectively,"priority management, decision sequencing",GENERAL_CONCERN
FAM_EXEC_003,DOM_006,Executive Function Intelligence,task_completion_signals,Measure consistency in completing assigned tasks,"completion behavior, follow-through",GENERAL_CONCERN
FAM_EXEC_004,DOM_006,Executive Function Intelligence,execution_consistency_signals,Detect consistency in execution quality,"reliability, execution stability",GENERAL_CONCERN
FAM_EXEC_005,DOM_006,Executive Function Intelligence,organization_signals,Assess organizational discipline and structure,"organization, systematic behavior",DISCIPLINE_HABITS
FAM_EXEC_006,DOM_006,Executive Function Intelligence,structure_signals,Measure dependence on routines and structure,"structure stability, routine management",DISCIPLINE_HABITS
FAM_EXEC_007,DOM_006,Executive Function Intelligence,time_management_signals,Evaluate effective use of time and deadlines,"punctuality, scheduling discipline",DISCIPLINE_HABITS
FAM_EXEC_008,DOM_006,Executive Function Intelligence,productivity_signals,Measure productive work behavior,"productivity, efficiency",GENERAL_CONCERN
FAM_EXEC_009,DOM_006,Executive Function Intelligence,followthrough_signals,Assess persistence in finishing initiated work,"consistency, sustained execution",GENERAL_CONCERN
FAM_EXEC_010,DOM_006,Executive Function Intelligence,operational_discipline_signals,Measure discipline in operational execution,"process adherence, disciplined action",DISCIPLINE_HABITS
FAM_EXEC_011,DOM_006,Executive Function Intelligence,attention_control_signals,Evaluate focus and attention regulation,"focus stability, distraction control",GENERAL_CONCERN
FAM_EXEC_012,DOM_006,Executive Function Intelligence,cognitive_control_signals,Assess regulation of impulses and thinking patterns,"impulse control, mental regulation",GENERAL_CONCERN
FAM_EXEC_013,DOM_006,Executive Function Intelligence,workflow_management_signals,Measure workflow coordination and management,"workflow structure, process flow",GENERAL_CONCERN
FAM_EXEC_014,DOM_006,Executive Function Intelligence,decision_execution_signals,Assess ability to convert decisions into action,"action initiation, execution activation",GENERAL_CONCERN
FAM_EXEC_015,DOM_006,Executive Function Intelligence,consistency_signals,Measure behavioral and execution consistency,"stable performance, routine reliability",DISCIPLINE_HABITS
FAM_EXEC_016,DOM_006,Executive Function Intelligence,deadline_management_signals,Assess handling of deadlines and pressure timelines,"deadline adherence, urgency handling",GENERAL_CONCERN
FAM_EXEC_017,DOM_006,Executive Function Intelligence,multitasking_signals,Evaluate handling of multiple simultaneous tasks,"task switching, workload balancing",GENERAL_CONCERN
FAM_EXEC_018,DOM_006,Executive Function Intelligence,execution_breakdown_signals,Detect failures in sustained execution,"execution collapse, incomplete tasks",GENERAL_CONCERN
FAM_EXEC_019,DOM_006,Executive Function Intelligence,self_regulation_signals,Measure ability to regulate actions and routines,"discipline, behavioral regulation",DISCIPLINE_HABITS
FAM_EXEC_020,DOM_006,Executive Function Intelligence,process_adherence_signals,Assess adherence to defined systems and processes,"compliance, systematic execution",GENERAL_CONCERN
FAM_IDEN_001,DOM_007,Identity Intelligence,self_belief_signals,Measure internal belief in personal capability and competence,"self-confidence, capability belief, self-trust",GENERAL_CONCERN
FAM_IDEN_002,DOM_007,Identity Intelligence,self_worth_signals,Assess perceived self-value and emotional worthiness,"self-esteem, inadequacy, worth instability",ADJUSTMENT_COPING
FAM_IDEN_003,DOM_007,Identity Intelligence,identity_clarity_signals,Measure clarity and stability of personal identity,"self-definition, identity certainty",GENERAL_CONCERN
FAM_IDEN_004,DOM_007,Identity Intelligence,purpose_signals,Assess sense of meaning and life direction,"purpose clarity, meaning orientation",GENERAL_CONCERN
FAM_IDEN_005,DOM_007,Identity Intelligence,self_acceptance_signals,"Measure acceptance of strengths, weaknesses, and individuality","self-acceptance, emotional comfort with self",ADJUSTMENT_COPING
FAM_IDEN_006,DOM_007,Identity Intelligence,authenticity_signals,Assess authenticity and alignment between inner self and external behavior,"genuineness, identity congruence",GENERAL_CONCERN
FAM_IDEN_007,DOM_007,Identity Intelligence,identity_confusion_signals,Detect instability and confusion in self-concept,"uncertainty, role confusion",GENERAL_CONCERN
FAM_IDEN_008,DOM_007,Identity Intelligence,self_respect_signals,Measure personal dignity and self-respect,"boundary protection, self-value",GENERAL_CONCERN
FAM_IDEN_009,DOM_007,Identity Intelligence,personal_values_signals,Assess clarity and consistency of personal values,"ethics, principles, value alignment",GENERAL_CONCERN
FAM_IDEN_010,DOM_007,Identity Intelligence,individuality_signals,Measure comfort in expressing individuality,"uniqueness expression, independent identity",GENERAL_CONCERN
FAM_IDEN_011,DOM_007,Identity Intelligence,internal_validation_signals,Assess ability to self-validate without excessive external approval,"internal confidence, emotional independence",ADJUSTMENT_COPING
FAM_IDEN_012,DOM_007,Identity Intelligence,identity_stability_signals,Measure consistency of self-perception across situations,"stable identity, emotional continuity",ADJUSTMENT_COPING
FAM_IDEN_013,DOM_007,Identity Intelligence,self_awareness_signals,"Assess awareness of strengths, weaknesses, and emotional patterns","introspection, self-understanding",ADJUSTMENT_COPING
FAM_IDEN_014,DOM_007,Identity Intelligence,aspiration_identity_signals,Measure alignment between ambitions and identity,"aspiration clarity, future self-image",GENERAL_CONCERN
FAM_IDEN_015,DOM_007,Identity Intelligence,role_identity_signals,Assess comfort and clarity in social and professional roles,"role adaptation, role certainty",GENERAL_CONCERN
FAM_IDEN_016,DOM_007,Identity Intelligence,self_expression_signals,Measure confidence in expressing personal thoughts and identity,"openness, emotional expression",ADJUSTMENT_COPING
FAM_IDEN_017,DOM_007,Identity Intelligence,confidence_foundation_signals,Assess foundational emotional confidence independent of performance,"emotional stability, baseline confidence",ADJUSTMENT_COPING
FAM_IDEN_018,DOM_007,Identity Intelligence,identity_resilience_signals,Measure ability to maintain self-identity during setbacks or criticism,"identity endurance, emotional resilience",ADJUSTMENT_COPING
FAM_IDEN_019,DOM_007,Identity Intelligence,self_definition_signals,Assess clarity in describing and understanding oneself,"self-concept articulation, identity awareness",GENERAL_CONCERN
FAM_IDEN_020,DOM_007,Identity Intelligence,belonging_identity_signals,Measure identity security within groups and social environments,"belonging confidence, social identity security",GENERAL_CONCERN
FAM_ADAPT_001,DOM_008,Adaptive Intelligence,adaptability_signals,Measure overall adaptability to changing environments and uncertainty,"adaptability, adjustment capacity, flexibility",ADJUSTMENT_COPING
FAM_ADAPT_002,DOM_008,Adaptive Intelligence,flexibility_signals,Assess cognitive and behavioral flexibility during transitions,"mental flexibility, behavioral adjustment",ADJUSTMENT_COPING
FAM_ADAPT_003,DOM_008,Adaptive Intelligence,transition_signals,"Evaluate how individuals handle life, academic, or career transitions","transition handling, adaptation stress",CAREER_READINESS
FAM_ADAPT_004,DOM_008,Adaptive Intelligence,uncertainty_navigation_signals,Measure comfort and functioning under uncertain situations,"uncertainty tolerance, ambiguity handling",GENERAL_CONCERN
FAM_ADAPT_005,DOM_008,Adaptive Intelligence,change_acceptance_signals,Assess openness toward change and new environments,"change acceptance, resistance reduction",GENERAL_CONCERN
