family_id,domain_id,Domain,family_name,family_purpose,key_behavioral_scope,relational_bridge_tag
FAM_WELL_004,DOM_015,Wellbeing Intelligence,self_care_signals,Measure consistency of self-care and recovery behaviors,"self-care habits, recovery practices",GENERAL_CONCERN
FAM_WELL_005,DOM_015,Wellbeing Intelligence,sleep_health_signals,Evaluate sleep quality and sleep consistency impact,"sleep quality, sleep deprivation",GENERAL_CONCERN
FAM_WELL_006,DOM_015,Wellbeing Intelligence,emotional_balance_signals,Measure emotional stability and emotional equilibrium,"emotional fluctuations, emotional steadiness",ADJUSTMENT_COPING
FAM_WELL_007,DOM_015,Wellbeing Intelligence,energy_regulation_signals,Assess daily energy sustainability and burnout tendency,"energy cycles, depletion patterns",GENERAL_CONCERN
FAM_WELL_008,DOM_015,Wellbeing Intelligence,lifestyle_stability_signals,Measure routine consistency and healthy lifestyle structure,"routine balance, lifestyle discipline",DISCIPLINE_HABITS
FAM_WELL_009,DOM_015,Wellbeing Intelligence,burnout_prevention_signals,Detect early burnout risk indicators,"overload, exhaustion, burnout escalation",GENERAL_CONCERN
FAM_WELL_010,DOM_015,Wellbeing Intelligence,recovery_quality_signals,Assess quality of emotional and physical recovery,"rest effectiveness, recovery sustainability",ADJUSTMENT_COPING
FAM_WELL_011,DOM_015,Wellbeing Intelligence,health_awareness_signals,Measure awareness and attention toward personal health,"health consciousness, wellbeing awareness",GENERAL_CONCERN
FAM_WELL_012,DOM_015,Wellbeing Intelligence,work_life_balance_signals,Evaluate balance between responsibilities and personal wellbeing,"imbalance, overcommitment",GENERAL_CONCERN
FAM_WELL_013,DOM_015,Wellbeing Intelligence,relaxation_signals,Assess ability to relax and mentally disengage from stress,"relaxation ability, mental calmness",ADJUSTMENT_COPING
FAM_WELL_014,DOM_015,Wellbeing Intelligence,emotional_recovery_signals,Measure recovery speed after emotional setbacks,"emotional resilience, emotional rebound",ADJUSTMENT_COPING
FAM_WELL_015,DOM_015,Wellbeing Intelligence,physical_wellbeing_signals,Assess physical wellness impact on overall functioning,"physical vitality, body wellness",GENERAL_CONCERN
FAM_WELL_016,DOM_015,Wellbeing Intelligence,mental_wellbeing_signals,Measure cognitive and emotional mental wellness,"mental stability, mental strain",ADJUSTMENT_COPING
FAM_WELL_017,DOM_015,Wellbeing Intelligence,stress_reactivity_signals,Detect intensity of reaction to stressful situations,"emotional reactivity, stress sensitivity",ADJUSTMENT_COPING
FAM_WELL_018,DOM_015,Wellbeing Intelligence,resilience_recovery_signals,Assess resilience sustainability after repeated pressure,"endurance, recovery persistence",GENERAL_CONCERN
FAM_WELL_019,DOM_015,Wellbeing Intelligence,wellness_consistency_signals,Measure long-term consistency of wellness behaviors,healthy habit continuity,DISCIPLINE_HABITS
FAM_WELL_020,DOM_015,Wellbeing Intelligence,holistic_health_signals,"Evaluate integrated physical, emotional, and psychological wellbeing","holistic wellness, integrated health functioning",ADJUSTMENT_COPING
FAM_EMP_001,DOM_016,Employability Intelligence,workplace_readiness_signals,Measure readiness to function effectively in professional environments,"workplace adaptation, professional preparedness",CAREER_READINESS
FAM_EMP_002,DOM_016,Employability Intelligence,employability_gap_signals,Detect gaps affecting employability and placement success,"skill deficiencies, employability instability",CAREER_READINESS
FAM_EMP_003,DOM_016,Employability Intelligence,professional_competency_signals,Assess practical competency required for industry roles,"technical capability, execution quality",CAREER_READINESS
FAM_EMP_004,DOM_016,Employability Intelligence,practical_exposure_signals,Measure exposure to real-world work environments and industry practices,"internships, workplace familiarity",CAREER_READINESS
FAM_EMP_005,DOM_016,Employability Intelligence,interview_readiness_signals,Evaluate preparation and confidence for interviews and evaluations,"interview preparedness, response confidence",CAREER_READINESS
FAM_EMP_006,DOM_016,Employability Intelligence,communication_for_employability_signals,Assess workplace communication effectiveness,"professional communication, articulation",CAREER_READINESS
FAM_EMP_007,DOM_016,Employability Intelligence,workplace_adaptability_signals,Measure ability to adjust to organizational and workplace demands,"adaptability, transition flexibility",CAREER_READINESS
FAM_EMP_008,DOM_016,Employability Intelligence,execution_reliability_signals,Assess consistency in task execution and delivery,"accountability, task completion",CAREER_READINESS
FAM_EMP_009,DOM_016,Employability Intelligence,professional_confidence_signals,Measure confidence in handling professional responsibilities,"workplace confidence, self-belief",CAREER_READINESS
FAM_EMP_010,DOM_016,Employability Intelligence,career_transition_signals,Evaluate readiness for transition from academics to industry,"transition preparedness, adjustment capability",CAREER_READINESS
FAM_EMP_011,DOM_016,Employability Intelligence,workplace_behavior_signals,Assess professional behavior and workplace discipline,"punctuality, professionalism",CAREER_READINESS
FAM_EMP_012,DOM_016,Employability Intelligence,industry_alignment_signals,Measure alignment between skills and market expectations,"industry relevance, role-fit awareness",CAREER_READINESS
FAM_EMP_013,DOM_016,Employability Intelligence,learning_agility_signals,Assess ability to learn quickly in changing work environments,"rapid learning, adaptability",CAREER_READINESS
FAM_EMP_014,DOM_016,Employability Intelligence,problem_solving_signals,Measure workplace problem-solving capability,"analytical thinking, solution orientation",CAREER_READINESS
FAM_EMP_015,DOM_016,Employability Intelligence,collaboration_for_workplace_signals,Assess teamwork readiness in professional environments,"collaboration, team participation",CAREER_READINESS
FAM_EMP_016,DOM_016,Employability Intelligence,accountability_for_work_signals,Measure ownership and responsibility in work execution,"ownership, responsibility handling",CAREER_READINESS
FAM_EMP_017,DOM_016,Employability Intelligence,workplace_resilience_signals,Assess ability to sustain performance under workplace pressure,"resilience, pressure tolerance",CAREER_READINESS
FAM_EMP_018,DOM_016,Employability Intelligence,employability_motivation_signals,Measure motivation toward employability and career preparation,"placement drive, professional ambition",CAREER_READINESS
FAM_EMP_019,DOM_016,Employability Intelligence,professional_identity_signals,Assess development of professional self-concept and identity,"professional self-image, career identity",CAREER_READINESS
FAM_EMP_020,DOM_016,Employability Intelligence,workplace_ethics_signals,Measure ethical behavior and integrity in professional settings,"ethics, workplace trustworthiness",CAREER_READINESS
FAM_LEAD_001,DOM_017,Leadership Intelligence,initiative_signals,Measure proactive behavior and willingness to take action,"initiative, self-starting behavior, proactive execution",GENERAL_CONCERN
FAM_LEAD_002,DOM_017,Leadership Intelligence,ownership_signals,Assess accountability and responsibility-taking patterns,"accountability, ownership, responsibility acceptance",GENERAL_CONCERN
FAM_LEAD_003,DOM_017,Leadership Intelligence,leadership_presence_signals,Evaluate confidence and influence in leadership situations,"presence, visibility, authority projection",GENERAL_CONCERN
FAM_LEAD_004,DOM_017,Leadership Intelligence,influence_signals,Measure ability to positively influence others,"persuasion, motivation, social influence",GENERAL_CONCERN
FAM_LEAD_005,DOM_017,Leadership Intelligence,decision_leadership_signals,Assess decision-making ability under responsibility,"leadership judgment, decisive action",GENERAL_CONCERN
FAM_LEAD_006,DOM_017,Leadership Intelligence,accountability_execution_signals,Measure consistency in delivering commitments,"reliability, execution ownership",GENERAL_CONCERN
FAM_LEAD_007,DOM_017,Leadership Intelligence,team_guidance_signals,Assess ability to guide and support teams,"mentoring, direction-setting, support behavior",GENERAL_CONCERN
FAM_LEAD_008,DOM_017,Leadership Intelligence,conflict_leadership_signals,Measure leadership during conflicts and disagreements,"mediation, conflict resolution, stability",GENERAL_CONCERN
FAM_LEAD_009,DOM_017,Leadership Intelligence,strategic_thinking_signals,Assess long-term leadership thinking capability,"planning, strategic foresight, vision orientation",GENERAL_CONCERN
FAM_LEAD_010,DOM_017,Leadership Intelligence,motivational_leadership_signals,Measure ability to inspire and energize others,"inspiration, encouragement, morale-building",GENERAL_CONCERN
FAM_LEAD_011,DOM_017,Leadership Intelligence,delegation_signals,Assess delegation and task distribution effectiveness,"delegation, coordination, trust distribution",GENERAL_CONCERN
FAM_LEAD_012,DOM_017,Leadership Intelligence,adaptability_leadership_signals,Measure flexibility during uncertainty and change,"adaptability, transition leadership",GENERAL_CONCERN
FAM_LEAD_013,DOM_017,Leadership Intelligence,ethical_leadership_signals,Assess ethical consistency in leadership decisions,"integrity, fairness, ethical judgment",GENERAL_CONCERN
FAM_LEAD_014,DOM_017,Leadership Intelligence,execution_leadership_signals,Measure ability to convert plans into outcomes,"execution discipline, delivery focus",DISCIPLINE_HABITS
FAM_LEAD_015,DOM_017,Leadership Intelligence,confidence_projection_signals,Assess leadership confidence in high-pressure environments,"confidence projection, authority stability",GENERAL_CONCERN
FAM_LEAD_016,DOM_017,Leadership Intelligence,responsibility_acceptance_signals,Measure willingness to accept difficult responsibilities,"responsibility tolerance, accountability readiness",GENERAL_CONCERN
FAM_LEAD_017,DOM_017,Leadership Intelligence,resilience_leadership_signals,Assess recovery and composure during setbacks,"resilience, emotional steadiness",ADJUSTMENT_COPING
FAM_LEAD_018,DOM_017,Leadership Intelligence,communication_leadership_signals,Measure leadership communication effectiveness,"articulation, clarity, persuasive communication",GENERAL_CONCERN
FAM_LEAD_019,DOM_017,Leadership Intelligence,vision_alignment_signals,Assess ability to align people around shared goals,"alignment, mission focus, collective direction",GENERAL_CONCERN
FAM_LEAD_020,DOM_017,Leadership Intelligence,growth_leadership_signals,Measure commitment toward continuous leadership improvement,"self-development, feedback acceptance, growth mindset",GENERAL_CONCERN
FAM_COL_001,DOM_018,Collaboration Intelligence,teamwork_signals,Measure effectiveness in working within teams,"team participation, contribution quality, shared responsibility",GENERAL_CONCERN
FAM_COL_002,DOM_018,Collaboration Intelligence,cooperation_signals,Assess willingness to cooperate and support others,"cooperation, supportiveness, adaptability in teams",GENERAL_CONCERN
FAM_COL_003,DOM_018,Collaboration Intelligence,conflict_management_signals,Evaluate ability to handle disagreements constructively,"conflict resolution, emotional control, negotiation",ADJUSTMENT_COPING
FAM_COL_004,DOM_018,Collaboration Intelligence,trust_building_signals,Measure capability to build trust within teams,"reliability, openness, trust formation",GENERAL_CONCERN
FAM_COL_005,DOM_018,Collaboration Intelligence,communication_alignment_signals,Assess clarity and alignment in collaborative communication,"communication consistency, understanding, alignment",GENERAL_CONCERN
FAM_COL_006,DOM_018,Collaboration Intelligence,peer_support_signals,Measure emotional and operational support toward peers,"encouragement, assistance, peer engagement",ADJUSTMENT_COPING
FAM_COL_007,DOM_018,Collaboration Intelligence,accountability_in_team_signals,Assess ownership and accountability within group tasks,"responsibility, ownership, follow-through",GENERAL_CONCERN
FAM_COL_008,DOM_018,Collaboration Intelligence,participation_balance_signals,Measure balance between over-dominance and under-participation,"participation balance, inclusiveness",GENERAL_CONCERN
FAM_COL_009,DOM_018,Collaboration Intelligence,group_engagement_signals,Evaluate engagement level during collaborative activities,"active involvement, attentiveness, initiative",GENERAL_CONCERN
FAM_COL_010,DOM_018,Collaboration Intelligence,listening_behavior_signals,Assess active listening and receptiveness to others,"listening quality, receptiveness, empathy",GENERAL_CONCERN
FAM_COL_011,DOM_018,Collaboration Intelligence,collaborative_problem_solving_signals,Measure effectiveness in solving problems collectively,"idea integration, solution-building, coordination",GENERAL_CONCERN
FAM_COL_012,DOM_018,Collaboration Intelligence,empathy_in_collaboration_signals,Assess empathy and emotional awareness within teamwork,"empathy, emotional sensitivity, social understanding",ADJUSTMENT_COPING
FAM_COL_013,DOM_018,Collaboration Intelligence,adaptability_in_teams_signals,Measure adaptability to changing team dynamics,"flexibility, role adjustment, openness to change",ADJUSTMENT_COPING
FAM_COL_014,DOM_018,Collaboration Intelligence,feedback_acceptance_signals,Evaluate openness to receiving and using feedback,"feedback handling, improvement orientation",GENERAL_CONCERN
FAM_COL_015,DOM_018,Collaboration Intelligence,feedback_delivery_signals,Assess ability to provide constructive feedback respectfully,"communication maturity, constructive criticism",GENERAL_CONCERN
FAM_COL_016,DOM_018,Collaboration Intelligence,coordination_signals,Measure coordination and synchronization with team processes,"workflow coordination, timing, collaboration efficiency",GENERAL_CONCERN
FAM_COL_017,DOM_018,Collaboration Intelligence,inclusiveness_signals,Assess inclusiveness and fairness within group interactions,"inclusivity, equal participation, acceptance",GENERAL_CONCERN
FAM_COL_018,DOM_018,Collaboration Intelligence,dependency_balance_signals,Measure healthy balance between independence and dependence in teams,"autonomy, collaboration balance",GENERAL_CONCERN
FAM_COL_019,DOM_018,Collaboration Intelligence,group_confidence_signals,Assess confidence while functioning in collaborative settings,"collaborative confidence, social comfort",GENERAL_CONCERN
FAM_COL_020,DOM_018,Collaboration Intelligence,collaborative_resilience_signals,Measure resilience and stability during difficult team situations,"persistence, emotional stability, recovery in teams",ADJUSTMENT_COPING
FAM_CRE_001,DOM_019,Creativity Intelligence,curiosity_signals,Measure intellectual curiosity and exploration tendency,"curiosity, exploration, questioning behavior",GENERAL_CONCERN
FAM_CRE_002,DOM_019,Creativity Intelligence,ideation_signals,Assess idea generation capability,"idea creation, brainstorming, originality",GENERAL_CONCERN
FAM_CRE_003,DOM_019,Creativity Intelligence,experimentation_signals,Measure willingness to experiment and try new approaches,"experimentation, trial behavior, innovation attempts",GENERAL_CONCERN
FAM_CRE_004,DOM_019,Creativity Intelligence,innovation_signals,Evaluate innovation orientation and creative problem-solving,"innovation, solution creation, inventive thinking",GENERAL_CONCERN
FAM_CRE_005,DOM_019,Creativity Intelligence,divergent_thinking_signals,Assess ability to think in multiple directions,"divergent thinking, idea flexibility",GENERAL_CONCERN
FAM_CRE_006,DOM_019,Creativity Intelligence,imagination_signals,Measure imaginative thinking and conceptual visualization,"imagination, conceptual thinking",GENERAL_CONCERN
FAM_CRE_007,DOM_019,Creativity Intelligence,creative_confidence_signals,Evaluate confidence in expressing creative ideas,"creative confidence, idea sharing",GENERAL_CONCERN
FAM_CRE_008,DOM_019,Creativity Intelligence,originality_signals,Assess uniqueness and originality in thought patterns,"originality, uniqueness",GENERAL_CONCERN
FAM_CRE_009,DOM_019,Creativity Intelligence,problem_reframing_signals,Measure ability to reinterpret problems creatively,"reframing, alternative perspectives",GENERAL_CONCERN
FAM_CRE_010,DOM_019,Creativity Intelligence,exploration_drive_signals,Assess intrinsic drive toward discovery and experimentation,"exploration drive, curiosity motivation",GENERAL_CONCERN
FAM_CRE_011,DOM_019,Creativity Intelligence,creative_risk_taking_signals,Measure willingness to take creative and unconventional risks,"risk-taking, unconventional thinking",GENERAL_CONCERN
FAM_CRE_012,DOM_019,Creativity Intelligence,adaptive_ideation_signals,Assess flexibility in generating ideas under changing situations,"adaptive ideation, flexible creativity",GENERAL_CONCERN
FAM_CRE_013,DOM_019,Creativity Intelligence,conceptual_linking_signals,Measure ability to connect unrelated concepts creatively,"association building, conceptual linking",GENERAL_CONCERN
FAM_CRE_014,DOM_019,Creativity Intelligence,innovation_execution_signals,Assess ability to convert ideas into actionable outcomes,"creative execution, innovation implementation",GENERAL_CONCERN
FAM_CRE_015,DOM_019,Creativity Intelligence,creative_persistence_signals,Measure persistence in solving problems creatively,"creative endurance, persistence",GENERAL_CONCERN
FAM_CRE_016,DOM_019,Creativity Intelligence,experimentation_resilience_signals,Assess recovery after failed experiments or rejected ideas,"resilience after failure, iteration mindset",GENERAL_CONCERN
FAM_CRE_017,DOM_019,Creativity Intelligence,artistic_expression_signals,Measure expressive and artistic communication patterns,"artistic expression, emotional creativity",ADJUSTMENT_COPING
FAM_CRE_018,DOM_019,Creativity Intelligence,curiosity_depth_signals,Assess depth and intensity of intellectual curiosity,"deep inquiry, analytical curiosity",GENERAL_CONCERN
FAM_CRE_019,DOM_019,Creativity Intelligence,future_visioning_signals,Measure ability to imagine future possibilities and scenarios,"future imagination, visionary thinking",GENERAL_CONCERN
FAM_CRE_020,DOM_019,Creativity Intelligence,unconventional_thinking_signals,Assess tendency to challenge norms and think differently,"unconventional thinking, norm disruption",GENERAL_CONCERN
FAM_EII_001,DOM_020,Ethical & Integrity Intelligence,integrity_signals,Measure ethical consistency and honesty in behavior,"honesty, ethical consistency, moral stability",GENERAL_CONCERN
FAM_EII_002,DOM_020,Ethical & Integrity Intelligence,accountability_signals,Assess accountability and responsibility ownership,"responsibility, accountability, ownership",GENERAL_CONCERN
FAM_EII_003,DOM_020,Ethical & Integrity Intelligence,ethical_judgment_signals,Measure ethical reasoning and moral decision quality,"ethical reasoning, moral evaluation",EXAM_STRESS
FAM_EII_004,DOM_020,Ethical & Integrity Intelligence,trustworthiness_signals,Detect reliability and credibility in behavior,"dependability, credibility, trustworthiness",GENERAL_CONCERN
FAM_EII_005,DOM_020,Ethical & Integrity Intelligence,transparency_signals,Assess openness and transparency in actions and communication,"openness, honesty in communication",GENERAL_CONCERN
FAM_EII_006,DOM_020,Ethical & Integrity Intelligence,value_alignment_signals,Measure alignment between values and behavior,"principle alignment, value consistency",GENERAL_CONCERN
FAM_EII_007,DOM_020,Ethical & Integrity Intelligence,fairness_signals,Detect fairness and unbiased decision-making,"fairness, impartiality, equal treatment",GENERAL_CONCERN
FAM_EII_008,DOM_020,Ethical & Integrity Intelligence,responsibility_commitment_signals,Assess commitment toward duties and obligations,"responsibility fulfillment, commitment reliability",GENERAL_CONCERN
FAM_EII_009,DOM_020,Ethical & Integrity Intelligence,rule_adherence_signals,Measure adherence to ethical rules and systems,"compliance, discipline, ethical boundaries",DISCIPLINE_HABITS
FAM_EII_010,DOM_020,Ethical & Integrity Intelligence,honesty_under_pressure_signals,Detect integrity stability during stressful situations,"pressure ethics, truthfulness under stress",ADJUSTMENT_COPING
FAM_EII_011,DOM_020,Ethical & Integrity Intelligence,moral_courage_signals,Assess willingness to stand for ethical principles,"ethical courage, standing against wrong behavior",GENERAL_CONCERN
FAM_EII_012,DOM_020,Ethical & Integrity Intelligence,ethical_conflict_resolution_signals,Measure handling of ethical conflicts and dilemmas,"ethical decision resolution, moral balancing",GENERAL_CONCERN
FAM_EII_013,DOM_020,Ethical & Integrity Intelligence,consistency_of_values_signals,Detect stability of ethical behavior across contexts,"behavioral consistency, value stability",GENERAL_CONCERN
FAM_EII_014,DOM_020,Ethical & Integrity Intelligence,social_responsibility_signals,Assess awareness toward social and collective responsibility,"social ethics, collective accountability",GENERAL_CONCERN
FAM_EII_015,DOM_020,Ethical & Integrity Intelligence,professional_ethics_signals,Measure workplace and professional ethical standards,"workplace ethics, professional responsibility",GENERAL_CONCERN
FAM_EII_016,DOM_020,Ethical & Integrity Intelligence,ethical_self_regulation_signals,Assess self-control against unethical impulses,"impulse control, ethical restraint",GENERAL_CONCERN
FAM_EII_017,DOM_020,Ethical & Integrity Intelligence,confidentiality_respect_signals,Measure respect for confidentiality and privacy,"trust protection, confidentiality handling",GENERAL_CONCERN
FAM_EII_018,DOM_020,Ethical & Integrity Intelligence,authenticity_signals,Detect genuineness and authenticity in behavior,"authenticity, genuine self-expression",GENERAL_CONCERN
FAM_EII_019,DOM_020,Ethical & Integrity Intelligence,integrity_under_observation_signals,Assess whether ethical behavior changes under supervision,"consistency under monitoring, authentic integrity",GENERAL_CONCERN
FAM_EII_020,DOM_020,Ethical & Integrity Intelligence,ethical_leadership_signals,Measure ethical influence and responsible leadership behavior,"ethical influence, principled leadership",GENERAL_CONCERN
