concern_id,concern_name,canonical_type,match_tokens
CONCERN_HOL_361,Securing Relevant Internships,Problem,securing relevant internships
CONCERN_HOL_461,Securing Interviews Despite Qualifications,Problem,securing interviews despite qualifications
CONCERN_IDE_1542,identifying personal blind spots,Capability,identifying personal blind spots
CONCERN_INQ_1171,Detecting Hidden High-Potential Students,Capability,detecting hidden high-potential detecting hidden high-potential hidden talent blindness display label capability detecting hidden high-potential whose concern category deficit-state hidden talent blindness topical overlap 25
CONCERN_INT_1312,Detect Future Readiness Gaps Across Students,Outcome,detect future readiness gaps across
CONCERN_INT_2158,Emotionally Reactive Students,Problem,emotionally reactive
CONCERN_LEA_1237,Institutional Readiness for Future Careers,Outcome,institutional readiness future careers
CONCERN_LEA_1259,Institutional Balance Between Excellence and Wellbeing,Problem,institutional balance between excellence wellbeing
CONCERN_LEA_1283,Instructional Quality During Faculty Turnover,Problem,instructional quality faculty turnover
CONCERN_LEA_1309,Student Cognitive Fatigue Patterns,Outcome,cognitive fatigue patterns
CONCERN_LEA_1725,Retaining Formulae,Problem,retaining formulae
CONCERN_LEA_1847,Child Becoming Too Dependent on Parents,Problem,child becoming too dependent parents
CONCERN_LEA_1958,Excessive Dependence on Tuition,Trait,excessive dependence tuition
CONCERN_LEA_1987,Preparedness for Surprise Tests,Problem,preparedness surprise tests
CONCERN_LEA_2111,Continuous Assessments,Problem,continuous assessments
CONCERN_LEA_2206,Handling Students Who Avoid Competitive Opportunities,Capability,avoid competitive opportunities
CONCERN_LEA_2475,Preparedness for Surprise Tests,Problem,preparedness surprise tests
CONCERN_LEA_513,Silence After Interviews,Problem,silence interviews
CONCERN_LEA_775,Imposter Syndrome After Promotions,Problem,imposter syndrome promotions
CONCERN_LEA_810,Build Long-Term Organizational Trust,Capability,long-term organizational trust long-term organizational trust organizational trust display label capability long-term organizational trust whose concern category deficit-state organizational trust topical overlap 00
CONCERN_LEA_863,Organizational Complexity Strategically,Problem,organizational complexity strategically
CONCERN_LIF_1024,Translate Domain Expertise into Broader Business Value,Problem,translate domain expertise broader business value
CONCERN_LIF_1180,Holistic Visibility into School-Wide Competency Ecosystems,Capability,holistic visibility school-wide competency ecosystems
CONCERN_LIF_1738,Gaming Addiction,Problem,gaming addiction
CONCERN_LIF_177,Distractions During Home Preparation,Problem,distractions home preparation
CONCERN_LIF_1772,Online Stranger Interactions,Problem,online stranger interactions
CONCERN_LIF_1773,Exposure to Adult Content,Problem,exposure adult content
CONCERN_LIF_1778,Handle Boredom,Capability,handle boredom handle boredom low boredom tolerance display label capability handle boredom whose concern category deficit-state low boredom tolerance topical overlap 50
CONCERN_LIF_1779,Declining Patience Levels,Trait,declining patience levels
CONCERN_LIF_1785,Eye Contact,Problem,eye contact
CONCERN_LIF_1830,Suicidal Thought Indicators,Problem,suicidal thought indicators
CONCERN_LIF_1839,Outdoor Play,Problem,outdoor play
CONCERN_LIF_1851,Disconnect from Notifications,Problem,disconnect notifications
CONCERN_LIF_187,Staying Focused in Long Coaching Sessions,Problem,staying focused long coaching sessions
CONCERN_LIF_1875,Child Sharing Personal Data Online,Problem,child sharing personal data online
CONCERN_LIF_1882,Child Obsessing Over Appearance,Problem,child obsessing appearance
CONCERN_LIF_1904,Child Refusing Offline Activities,Problem,child refusing offline activities
CONCERN_LIF_1917,Child Becoming Overly Defensive,Problem,child becoming overly defensive
CONCERN_LIF_2409,Healthy Study-Life Balance,Capability,healthy study-life balance healthy study-life balance study-life imbalance display label capability healthy study-life balance whose concern category deficit-state study-life imbalance topical overlap 50
CONCERN_LIF_2413,Students Becoming Dependent on Constant Supervision,Problem,becoming dependent constant supervision
CONCERN_LIF_2414,Routine Stability During Holidays and Breaks,Capability,routine stability holidays breaks routine stability holidays breaks holiday routine instability display label capability routine stability holidays breaks whose concern category deficit-state holiday routine instability topical overlap 17
CONCERN_LIF_30,Placement Interviews,Problem,placement interviews
CONCERN_LIF_509,Imposter Syndrome During Interviews,Problem,imposter syndrome interviews
CONCERN_LIF_530,Build a Distinctive Personal Brand,Capability,distinctive personal brand distinctive personal brand personal branding display label capability distinctive personal brand whose concern category deficit-state personal branding topical overlap 25
CONCERN_LIF_538,Returning After Maternity or Caregiving Breaks,Problem,returning maternity caregiving breaks
CONCERN_LIF_598,Navigate Organizational Politics Strategically,Capability,navigate organizational politics strategically navigate organizational politics strategically political navigation display label capability navigate organizational politics strategically whose concern category deficit-state political navigation topical overlap 00
CONCERN_LIF_654,Build Psychological Safety Within Teams,Capability,psychological safety within teams psychological safety within teams psychological safety display label capability psychological safety within teams whose concern category deficit-state psychological safety topical overlap 67
CONCERN_LIF_792,Handle Political Dynamics Strategically,Capability,handle political dynamics strategically handle political dynamics strategically political navigation display label capability handle political dynamics strategically whose concern category deficit-state political navigation topical overlap 25
CONCERN_LIF_908,Driving Enterprise Transformation Narratives,Capability,driving enterprise transformation narratives driving enterprise transformation narratives transformation narrative display label capability driving enterprise transformation narratives whose concern category deficit-state transformation narrative topical overlap 25
CONCERN_MOT_1165,Building School-Wide Competency Culture,Capability,school-wide competency culture school-wide competency culture competency culture display label capability school-wide competency culture whose concern category deficit-state competency culture topical overlap 67
CONCERN_MOT_120,Interview/Personality Test Rounds,Problem,interview personality test rounds
CONCERN_MOT_151,Information Overload During Preparation,Problem,information overload preparation
CONCERN_MOT_1625,recognize behavioral patterns,Problem,recognize behavioral patterns
CONCERN_MOT_1679,Prioritizing Tasks,Capability,prioritizing tasks
CONCERN_MOT_1688,School and Tuition Balance,Problem,school tuition balance
CONCERN_MOT_1796,General Knowledge,Problem,general knowledge
CONCERN_MOT_1811,Child Avoiding Challenges,Problem,child avoiding challenges
CONCERN_MOT_182,Handle Unsolved Questions Calmly,Capability,handle unsolved questions calmly
CONCERN_MOT_1828,Hyper-Competitive Mindset,Capability,hyper-competitive mindset hyper-competitive mindset excessive competition display label capability hyper-competitive mindset whose concern category deficit-state excessive competition topical overlap 00
CONCERN_MOT_1858,Excessive Dependency on Shortcuts,Trait,excessive dependency shortcuts
CONCERN_MOT_1899,Child Unable to Handle Delayed Rewards,Problem,child unable handle delayed rewards
CONCERN_MOT_190,Filter Useful Resources from Noise,Problem,filter useful resources noise
CONCERN_MOT_1975,Competitive Readiness,Outcome,competitive readiness
CONCERN_MOT_200,Holistic Stability During Competitive Preparation,Capability,holistic stability competitive preparation holistic stability competitive preparation competitive preparation instability display label capability holistic stability competitive preparation whose concern category deficit-state competitive preparation instability topical overlap 40
CONCERN_MOT_2041,Open-Ended Questions,Problem,open-ended questions
CONCERN_MOT_2084,Multiple Coaching Commitments,Problem,multiple coaching commitments
CONCERN_MOT_2155,Supporting Students with Weak Cognitive Endurance,Problem,cognitive endurance
CONCERN_MOT_2161,Supporting Students with Weak Self-Regulation Skills,Capability,self-regulation self-regulation self-regulation display label capability self-regulation whose concern category deficit-state self-regulation topical overlap 67
CONCERN_MOT_2276,Supporting Students with Weak Holistic Development Balance,Problem,holistic development balance
CONCERN_MOT_272,Transfer Skills Across Domains,Capability,transfer across domains transfer across domains transferability display label capability transfer across domains whose concern category deficit-state transferability topical overlap 00
CONCERN_MOT_281,Building Portfolio-Based Evidence of Skills,Capability,portfolio-based evidence portfolio-based evidence portfolio development display label capability portfolio-based evidence whose concern category deficit-state portfolio development topical overlap 25
CONCERN_MOT_292,Convert Theory into Projects,Problem,convert theory projects
CONCERN_MOT_694,Escalating Problems Professionally,Problem,escalating professionally
CONCERN_PER_1533,recognize behavioral patterns,Problem,recognize behavioral patterns
CONCERN_PER_1631,accepting weaknesses constructively,Problem,accepting weaknesses constructively
CONCERN_PER_1636,recognizing personal progress milestones,Problem,recognizing personal progress milestones
CONCERN_POT_1538,personal progress objectively,Problem,personal progress objectively
CONCERN_REF_1617,accurately evaluate personal strengths,Problem,accurately evaluate personal strengths
CONCERN_SEL_1416,distractions,Problem,distractions
CONCERN_SEL_1452,Avoidance of challenging tasks,Behavior,avoidance challenging tasks
CONCERN_SEL_1464,Resistance to behavioral feedback from teachers,Behavior,resistance behavioral feedback teachers
CONCERN_SEL_1499,Confusion between passion and temporary excitement,Problem,confusion between passion temporary excitement
CONCERN_SEL_1618,identifying improvement areas,Capability,identifying improvement areas
CONCERN_SEL_1676,Following Instructions Properly,Problem,following instructions properly
CONCERN_SEL_2023,Structuring Long Answers,Problem,structuring long answers
CONCERN_SEL_2150,Supporting Students with Weak Real-World Application Skills,Capability,real-world application real-world application real-world application gap display label capability real-world application whose concern category deficit-state real-world application gap topical overlap 67
CONCERN_SEL_2227,Students with Overloaded Tuition Schedules,Problem,overloaded tuition schedules
CONCERN_SEL_295,Prioritizing Practice Over Passive Consumption,Capability,prioritizing practice passive consumption
CONCERN_SOC_1471,Students unable to handle criticism constructively,Problem,unable handle criticism constructively
CONCERN_SOC_1640,adapting after poor performance outcomes,Capability,adapting performance outcomes
CONCERN_SOC_1771,Cyberbullying Exposure,Problem,cyberbullying exposure
CONCERN_SOC_1783,Avoidance of Family Interaction,Behavior,avoidance family interaction
CONCERN_SOC_1806,Accept Criticism,Problem,accept criticism
CONCERN_SOC_1809,Overprotective Parenting Impact,Problem,overprotective parenting impact
CONCERN_SOC_1881,Child Becoming Too Emotionally Sensitive Online,Problem,child becoming too emotionally sensitive online
CONCERN_SOC_1890,Child Feeling Constantly Judged,Problem,child feeling constantly judged
CONCERN_SOC_1902,Child Becoming Emotionally Dependent on Online Communities,Problem,child becoming emotionally dependent online communities
CONCERN_SOC_1922,Child Developing Negative Self-Talk,Problem,child negative self-talk
CONCERN_SOC_2373,Trust Building Among Students,Problem,trust among
CONCERN_SOC_2376,Students Escalating Conflicts Emotionally,Problem,escalating conflicts emotionally
CONCERN_SOC_2389,Students Struggling to Handle Criticism Constructively,Problem,handle criticism constructively
CONCERN_STE_1729,Practical Application of Knowledge,Problem,practical application knowledge
CONCERN_STE_2025,Unexpected Questions,Problem,unexpected questions
CONCERN_STE_2107,Scientific Temperament,Problem,scientific temperament
CONCERN_STE_2201,Students Who Depend Excessively on Model Answers,Problem,depend excessively model answers
CONCERN_STR_219,Identifying Careers Aligned to Personality,Capability,identifying careers aligned personality identifying careers aligned personality personality-career misalignment display label capability identifying careers aligned personality whose concern category deficit-state personality-career misalignment topical overlap 20
CONCERN_STR_267,Applying Skills in Real-World Scenarios,Capability,applying real-world scenarios applying real-world scenarios real-world application display label capability applying real-world scenarios whose concern category deficit-state real-world application topical overlap 33
CONCERN_STR_588,Handle Constructive Criticism Professionally,Capability,handle constructive criticism professionally
CONCERN_STR_826,Build Psychological Safety Across Diverse Teams,Capability,psychological safety across diverse teams psychological safety across diverse teams psychological safety display label capability psychological safety across diverse teams whose concern category deficit-state psychological safety topical overlap 50
CONCERN_STR_882,Build Scalable Organizational Culture,Capability,scalable organizational culture scalable organizational culture culture display label capability scalable organizational culture whose concern category deficit-state culture topical overlap 50
CONCERN_TAL_1172,Measure Future Readiness Institutionally,Outcome,measure future readiness institutionally
CONCERN_THI_123,Sleep During Preparation Cycles,Problem,sleep preparation cycles
CONCERN_THI_129,Recovering Momentum After Breaks,Problem,recovering momentum breaks
CONCERN_THI_1323,Aligning Student Skills with Market Demand Trends,Capability,aligning market demand trends aligning market demand trends skill-market misalignment display label capability aligning market demand trends whose concern category deficit-state skill-market misalignment topical overlap 20
CONCERN_THI_1682,Competitive Environments,Problem,competitive environments
CONCERN_THI_183,Family Sacrifice Guilt During Preparation,Problem,family sacrifice guilt preparation
CONCERN_THI_1838,Declining Physical Fitness,Problem,declining physical fitness
CONCERN_THI_1960,Applying Knowledge Practically,Capability,applying knowledge practically applying knowledge practically practical application gap display label capability applying knowledge practically whose concern category deficit-state practical application gap topical overlap 00
CONCERN_THI_2013,Retaining Multi-Step Procedures,Problem,retaining multi-step procedures
CONCERN_THI_2193,Students with Inconsistent Attendance,Problem,inconsistent attendance
CONCERN_THI_2350,Complexity in Competitive Questions,Problem,complexity competitive questions
CONCERN_THI_2354,Error Recognition During Assessments,Problem,error recognition assessments
CONCERN_THI_317,Building Long-Term Competency Roadmaps,Capability,long-term competency roadmaps long-term competency roadmaps competency roadmap display label capability long-term competency roadmaps whose concern category deficit-state competency roadmap topical overlap 33
CONCERN_THI_476,Switching Careers Midway,Problem,switching careers midway
CONCERN_THI_894,Build Trust During Organizational Restructuring,Capability,trust organizational restructuring trust organizational restructuring restructuring trust display label capability trust organizational restructuring whose concern category deficit-state restructuring trust topical overlap 00
CONCERN_TRA_2312,Child Unable to Handle Sudden Routine Changes,Problem,child unable handle sudden routine changes
CONCERN_VOC_1400,Students pursuing careers misaligned with personality,Problem,pursuing careers misaligned personality
CONCERN_WOR_562,High-Stakes Presentations,Problem,high-stakes presentations
CONCERN_WOR_622,Navigate Matrix Reporting Structures,Capability,navigate matrix reporting structures navigate matrix reporting structures matrix structure navigation display label capability navigate matrix reporting structures whose concern category deficit-state matrix structure navigation topical overlap 20
CONCERN_WOR_673,Imposter Syndrome in Early Roles,Problem,imposter syndrome early roles
CONCERN_WOR_772,Build Successor Readiness Within Teams,Outcome,successor readiness within teams
